{
  "x": [
    [
      0.0
    ],
    [
      1.0
    ],
    [
      2.0
    ],
    [
      3.0
    ],
    [
      4.0
    ],
    [
      5.0
    ],
    [
      6.0
    ],
    [
      7.0
    ],
    [
      8.0
    ],
    [
      9.0
    ],
    [
      10.0
    ],
    [
      11.0
    ]
  ],
  "y": [
    1.0,
    3.0,
    5.0,
    7.0,
    9.0,
    11.0,
    13.0,
    15.0,
    17.0,
    19.0,
    21.0,
    23.0
  ],
  "seed": 0,
  "max_evaluations": 6,
  "inner_epochs": 10,
  "epochs": 20
}
